"c";"Condition & Recovery";"6";"5";"4";"3";"2";"1"
"-6 or more";"The spell fails to restore your life.";"Your deity may allow your return on a second attempt, but you must perform a Quest immediately upon revival.";"The embrace of your deity is all you feel, and it holds you tightly. Any additional attempts are permitted at -1.";"You hear the calls of your friends but you can do nothing to respond. Any additional attempts are at -3.";"All you feel is the sensation of falling, falling, falling into nothings. Any additional attempts are at -5.";"You are surrounded by ghostly figures who torment and taunt you. No additional attempts are permitted.";"Your soul is extinguished in the oblivion of nothingness. No additional attempts are permitted."
"-5 – 0";"The spell fails to restore your life.";"A stirring wind and a light come from somewhere, and you slowly move towards them. A second attempt is permitted.";"Your deity may allow your return on a second attempt, but you must perform a quest immediately upon revival.";"The embrace of your deity is all you feel, and it holds you tightly. Any additional attempts are permitted at -1.";"You hear the calls of your friends but you can do nothing to respond. Any additional attempts are at -3.";"All you feel is the sensation of falling, falling, falling into nothings. Any additional attempts are at -5.";"Your spirit wanders in emptiness. No additional attempts are permitted."
"1 – 5";"The powers of the spell restore you but at great cost. You need a month of bed rest.";"You smell of the wild. You suffer a -4 to reaction rolls with normal humans, but animals treat you like one of them unless you attack them or engage in civilized behavior in their presence.";"Tampering with mortality takes a toll. You permanently lose 1 point of Constitution.";"Who were you? Fragments of your mind are missing. You permanently forget 1 general proficiency and no longer recognize one random henchman, who suffers -2 penalty to morale for being seen as forgettable";"You either (50% either way) shrink to tiny size (as per shrinking) or grow to giant size (as per growth). Since you are unused to your new size, your DEX is immediately reduced to 3; it increases by 1 point per week until reaches its normal score.";"All you see is darkness. You are now blind (blinded, -4 to all attack throws, no line of sight for spells, movement ¼ normal, -2 to surprise rolls) in full daylight, but you can see invisible as the spell once per day.";"Heart beats and blood flows, but life doesn’t feel the same. Your CON and WIS are reduced by 1d4 each."
"6 – 10";"Your life and limb are restored, but with weird, lingering effects. You need 3 weeks of bed rest.";"Something wicked has taken an interest in you. A cacodemon spawn becomes your familiar, as the proficiency, but it does not always obey your comments.";"Your metabolism slows down. You need only half normal rations, but gain 1d10 lbs now +  1d10 lbs / year no matter how much you adventure.";"Tampering with mortality has a deleterious effect on your mind. You permanently lose 1 point of Wisdom.";"You did not return altogether human. You begin to resemble whatever animal best represents you (Judge’s discretion). You suffer -4 to reaction rolls with normal humans.";"The fabric of your mind frays and cracks. Each day upon awakening, you must make a Spells save or completely forget who you are. Once dementia sets in, the effect lasts for 1d6 days.";"Your soul is marked and all extraplanar beings wish you dead, targeting you over allies. Every week, there is a 1 in 6 chance an 8 HD elemental will be sent to destroy you."
"11 – 15";"The restoration of life and limb was intense, and you remember little of the ordeal. You need 2 weeks of bed rest.";"No side effects.";"Your brush with death has shattered your former confidence. Take a 10% penalty to XP until your next level.";"You have trouble managing slumber. Anytime you rest, you slumber for a random 2d6+2 hours; during this time you cannot be woke unless damaged, and even then you fall asleep again after one round.";"You grow an alien eye on the center of your forehead. The eye stays lidded most of the time. Three times per day you may unlid the eye and use the telepathy spell). Normal men view you with fear and trepidation (-3 to reaction rolls).";"There is a 5% cumulative chance each day you sink into madness. Roll for your actions each round as if suffering madness. The madness lasts for 1d6 days; the chance then resets.   ";"It feels like another being sometimes controls your right arm. When you roll a natural 1 on an attack throw, you hit an adjacent ally instead of an enemy."
"16 – 20";"You open your eyes to a body made whole. You need 2 weeks of bed rest.";"You feel blessed by your god. You recover 1d6 days quicker than you normally would. All negative side effects are removed.";"No side effects.";"Your brush with death has shattered your former confidence. Take a 10% penalty to XP until your next level.";"You take on a minor physical trait of an animal associated with your culture or religion. You suffer a -2 penalty to reaction rolls with those from outside your culture.";"Your restored body has bottomless hungers. If you casually smoke or consume alcohol, you are fully addicted. You suffer a cumulative -1 penalty to all Saving Throws after each hour you don’t consume something";"Your body is healthy, but… different. You are now a member of the opposite sex. -2 reaction rolls with characters who knew your prior gender unless your CHA is 13+."
"21 – 25";"The touch of your friends restores your health. You need 1 week of bed rest.";"Your brush with death has gifted you with the ability to speak with dead once per week. All negative side effects are removed. ";"You feel blessed by your god and recover 1d6 days quicker than you normally would. All negative side effects are removed.";"No side effects.";"Your brush with death has shattered your former confidence. Take a 10% penalty to XP until your next level.";"Whispers from beyond plague you. It is difficult to ignore them and you suffer -2 to Listening throws and -1 penalty to initiative and surprise rolls.";"Your life has come at the cost of the life of your future offspring. You are sterile and cannot have children naturally."
26;"The gods bless their favor upon you. You are instantly recovered without need of rest.";"You gain permanent power. Gain +2 in your class’s prime requisite statistic. All negative side effects are removed.";"A sublime power grants you a vision which you believe is of terrible import. The GM will give you a (true?) prophecy.";"You are filled with divine energy. For one day, you gain the benefits of a Valor potion. All negative side effects are removed. ";"No side effects.";"Your brush with death has shattered your former confidence. Take a 10% penalty to XP until your next level.";"The flavors of food reverse – salty becomes sweet, sour becomes bitter. Ordinary food tastes inedible to you and you must have your meals and rations prepared just for you."
